Difficulty,Grade,Criteria,Target_4button,Target_sound_alike,Target_look_alike,Target_sound_look_alike,Target_no_sound_look,Foil_sound_alike,Foil_look_alike,Foil_sound_look_alike,Foil_no_sound_look
1,k,"['sound_look_alike', 'no_sound_look', 'sound_alike', 'sound_look_alike', 'sound_look_alike', 'look_alike', 'sound_look_alike', 'sound_alike', 'no_sound_look', 'sound_look_alike', 'look_alike', 'look_alike', 'no_sound_look', 'look_alike', 'no_sound_look', 'no_sound_look', 'sound_look_alike', 'sound_look_alike', 'sound_look_alike', 'look_alike', 'sound_alike', 'sound_look_alike', 'sound_look_alike', 'sound_look_alike', 'no_sound_look', 'sound_look_alike', 'sound_look_alike', 'sound_alike', 'no_sound_look', 'sound_look_alike', 'sound_look_alike', 'look_alike', 'sound_look_alike', 'no_sound_look', 'sound_alike', 'sound_look_alike', 'no_sound_look', 'sound_look_alike', 'look_alike', 'sound_look_alike', 'sound_alike', 'no_sound_look', 'sound_alike', 'sound_alike', 'sound_alike', 'sound_look_alike', 'no_sound_look', 'no_sound_look', 'sound_look_alike', 'no_sound_look', 'sound_look_alike', 'sound_look_alike', 'sound_look_alike', 'sound_look_alike', 'sound_look_alike', 'sound_alike', 'no_sound_look', 'sound_look_alike', 'no_sound_look', 'look_alike', 'look_alike', 'look_alike', 'no_sound_look', 'sound_look_alike', 'sound_alike', 'no_sound_look', 'no_sound_look', 'look_alike', 'no_sound_look', 'sound_alike', 'sound_alike', 'sound_look_alike', 'no_sound_look', 'no_sound_look', 'sound_alike', 'look_alike', 'no_sound_look', 'no_sound_look', 'sound_alike', 'sound_alike', 'no_sound_look', 'sound_alike', 'look_alike', 'no_sound_look', 'look_alike', 'look_alike', 'sound_alike', 'no_sound_look', 'sound_look_alike', 'sound_look_alike', 'sound_look_alike', 'look_alike', 'sound_look_alike', 'sound_look_alike', 'no_sound_look', 'look_alike', 'sound_alike', 'sound_alike', 'sound_alike', 'look_alike']",,"['an', 'me', 'we', 'no', 'he', 'an', 'go', 'you', 'go', 'he', 'it', 'is', 'up', 'at', 'at', 'me', 'we', 'so', 'me', 'so', 'an', 'am', 'on', 'am', 'no', 'you', 'is', 'to', 'see', 'we', 'me', 'see', 'my', 'see']","['the', 'he', 'an', 'and', 'no', 'he', 'to']","['can', 'at', 'is', 'at', 'at', 'an', 'an']","['so', 'we', 'in', 'and', 'no', 'in', 'the', 'go', 'go', 'so', 'is', 'like', 'no', 'an', 'the', 'he', 'is', 'my', 'no', 'like', 'me', 'so', 'see', 'an', 'see', 'at', 'up', 'at', 'he', 'in', 'to', 'he', 'is', 'and', 'the', 'up', 'up', 'like', 'is', 'see', 'we', 'my', 'you', 'an', 'an', 'me', 'see', 'to', 'he', 'and', 'no', 'in', 'and', 'at', 'so', 'you', 'am', 'see', 'it', 'me', 'you', 'see', 'at', 'the', 'to', 'so', 'he', 'an', 'my', 'can', 'up', 'on', 'to', 'you', 'am', 'in', 'like', 'am', 'in', 'like', 'to', 'see', 'no', 'we', 'can', 'you', 'me', 'am', 'the', 'like', 'in', 'my', 'an', 'and', 'we', 'we', 'the', 'is', 'can', 'to', 'in', 'go', 'my', 'can', 'the', 'me', 'go', 'to', 'no', 'at', 'on', 'can', 'is', 'up', 'can', 'in', 'and', 'he', 'it', 'to', 'we', 'in', 'we', 'in', 'see', 'we', 'like', 'to', 'an', 'like', 'it', 'me', 'you', 'no', 'me', 'can', 'on', 'it', 'can', 'in', 'an', 'no', 'at', 'my', 'you', 'can', 'to', 'to', 'to', 'is', 'no', 'go', 'see', 'me', 'is', 'on', 'and', 'can', 'see', 'so', 'an', 'can', 'is', 'is', 'my', 'it', 'is', 'an', 'it', 'on', 'at', 'is', 'am', 'go', 'see', 'can', 'the', 'to', 'see', 'see', 'we', 'it', 'my', 'up', 'we', 'on', 'you', 'to', 'in', 'to', 'go', 'like', 'see', 'to', 'up', 'no', 'like', 'he', 'go', 'so', 'my', 'my', 'to', 'the', 'and', 'can', 'at', 'can', 'at', 'you', 'it', 'he', 'at', 'like', 'am', 'go', 'you', 'can', 'at', 'an', 'up', 'is', 'like', 'he', 'am', 'at', 'we', 'my', 'can', 'in', 'it', 'like', 'you', 'we', 'an', 'and', 'to', 'he', 'the', 'up', 'you', 'is', 'go', 'we', 'go', 'at', 'see', 'at', 'like', 'it', 'so', 'you', 'he', 'is', 'in', 'he', 'he', 'you', 'and', 'me', 'up', 'an', 'in', 'up', 'my', 'to', 'in', 'and', 'it', 'go', 'can', 'see', 'an', 'he', 'the', 'so', 'you', 'see', 'me', 'you', 'on', 'on', 'it', 'and', 'go', 'me', 'it', 'am', 'in', 'and', 'go', 'go', 'at', 'me', 'like', 'in', 'up', 'you', 'an', 'he', 'on', 'it', 'go', 'he', 'and', 'can', 'an', 'we', 'can', 'see', 'up', 'he', 'so', 'go', 'on', 'he', 'no', 'see', 'you', 'see', 'the', 'see', 'my', 'can', 'to', 'like', 'on', 'at', 'no', 'my', 'is', 'and', 'like', 'we', 'no', 'like', 'my', 'at', 'my', 'my', 'so', 'to', 'can', 'is', 'me', 'an', 'at', 'on', 'an', 'go', 'can', 'it', 'on', 'an', 'you', 'my', 'so', 'it', 'so', 'and', 'am', 'go', 'so', 'you', 'so', 'no', 'to', 'is', 'my', 'is', 'my', 'to', 'go', 'it', 'and', 'see', 'me', 'up', 'we', 'no', 'me', 'it', 'we', 'the', 'am', 'an', 'an', 'we', 'to', 'at', 'you', 'is', 'in', 'it', 'an', 'up', 'at', 'can', 'so', 'he', 'like', 'we', 'is', 'in', 'the', 'am', 'we', 'and', 'he', 'an', 'it', 'am', 'no', 'no', 'go', 'and', 'no', 'at', 'up', 'see', 'no', 'no', 'in', 'at', 'he', 'am', 'the', 'like', 'in', 'is', 'you', 'the', 'the', 'in', 'am', 'we', 'can', 'up', 'to', 'to', 'up', 'in', 'you', 'go', 'and', 'like', 'you', 'up', 'so', 'is', 'so', 'the', 'can', 'am', 'at', 'go', 'to', 'my', 'you', 'at', 'see', 'on', 'an', 'up', 'me', 'you', 'me', 'can', 'at', 'see', 'in', 'up', 'on', 'my', 'me', 'see', 'see', 'is', 'he', 'and', 'me', 'the', 'in', 'to', 'we', 'and', 'at', 'it', 'he', 'me', 'you', 'go', 'like', 'and', 'am', 'in', 'can', 'he', 'me']","[u'at', u'be', u'see', u'so', u'him', u'am', u'so', u'to', u'no', u'his', u'is', u'if', u'of', u'an', u'am', u'we', u'me', u'go', u'see', u'no', u'on', u'an', u'an', u'at', u'go', u'two', u'it', u'you', u'me', u'be', u'my', u'be', u'me', u'we']","[u'he', u'the', u'and', u'an', u'not', u'her', u'toy']","[u'an', u'rat', u'his', u'hat', u'fat', u'man', u'can']","[u'hot', u'go', u'me', u'pig', u'it', u'big', u'day', u'toy', u'his', u'an', u'we', u'we', u'he', u'not', u'fat', u'bed', u'but', u'he', u'cow', u'mom', u'the', u'yes', u'yes', u'my', u'my', u'on', u'red', u'cow', u'an', u'his', u'like', u'big', u'her', u'yes', u'but', u'at', u'bed', u'up', u'he', u'on', u'her', u'to', u'and', u'it', u'but', u'him', u'bed', u'an', u'and', u'his', u'rat', u'my', u'mom', u'two', u'hen', u'the', u'like', u'if', u'me', u'an', u'not', u'hen', u'my', u'at', u'not', u'be', u'of', u'hat', u'be', u'toy', u'and', u'no', u'be', u'we', u'in', u'fat', u'go', u'see', u'can', u'my', u'his', u'it', u'hat', u'him', u'hat', u'it', u'can', u'big', u'him', u'for', u'not', u'not', u'to', u'on', u'he', u'two', u'like', u'at', u'but', u'it', u'cow', u'is', u'red', u'big', u'pig', u'fat', u'he', u'hot', u'mom', u'me', u'you', u'in', u'like', u'day', u'to', u'of', u'hen', u'hot', u'go', u'can', u'on', u'the', u'red', u'so', u'and', u'no', u'him', u'am', u'her', u'did', u'big', u'mom', u'rat', u'in', u'pet', u'two', u'rat', u'so', u'pig', u'yes', u'hen', u'on', u'is', u'big', u'fat', u'is', u'on', u'fat', u'pet', u'to', u'my', u'to', u'an', u'and', u'up', u'toy', u'no', u'the', u'at', u'him', u'his', u'cow', u'bed', u'hot', u'it', u'can', u'hen', u'the', u'on', u'the', u'he', u'go', u'yes', u'yes', u'rat', u'rat', u'her', u'me', u'day', u'two', u'big', u'day', u'go', u'rat', u'to', u'am', u'hot', u'pig', u'hot', u'in', u'pet', u'at', u'but', u'my', u'is', u'if', u'in', u'hat', u'can', u'can', u'pig', u'cow', u'man', u'red', u'for', u'like', u'his', u'so', u'in', u'red', u'in', u'no', u'big', u'the', u'be', u'did', u'did', u'am', u'bed', u'go', u'mom', u'him', u'red', u'we', u'hen', u'pet', u'the', u'on', u'no', u'am', u'did', u'be', u'yes', u'pig', u'big', u'if', u'did', u'you', u'cow', u'me', u'on', u'day', u'me', u'man', u'see', u'you', u'the', u'if', u'of', u'cow', u'did', u'his', u'rat', u'toy', u'for', u'can', u'pet', u'hen', u'her', u'yes', u'cow', u'two', u'an', u'fat', u'in', u'big', u'be', u'not', u'he', u'an', u'you', u'hat', u'fat', u'it', u'if', u'see', u'hat', u'in', u'two', u'for', u'but', u'and', u'am', u'day', u'up', u'bed', u'hat', u'man', u'hat', u'hot', u'and', u'for', u'day', u'at', u'hat', u'pig', u'his', u'mom', u'be', u'like', u'him', u'like', u'pig', u'to', u'so', u'be', u'him', u'like', u'we', u'is', u'you', u'did', u'red', u'hat', u'pet', u'two', u'fat', u'of', u'can', u'mom', u'hot', u'up', u'no', u'his', u'but', u'bed', u'me', u'pig', u'toy', u'like', u'pet', u'it', u'me', u'fat', u'am', u'if', u'did', u'her', u'man', u'bed', u'you', u'day', u'on', u'did', u'not', u'did', u'it', u'at', u'like', u'be', u'it', u'pet', u'in', u'you', u'man', u'up', u'the', u'the', u'like', u'me', u'but', u'man', u'is', u'no', u'at', u'man', u'for', u'can', u'so', u'see', u'her', u'if', u'fat', u'not', u'we', u'pet', u'but', u'no', u'and', u'up', u'rat', u'red', u'so', u'man', u'you', u'is', u'toy', u'his', u'bed', u'for', u'me', u'cow', u'her', u'mom', u'no', u'see', u'red', u'of', u'my', u'if', u'pet', u'hat', u'of', u'we', u'and', u'mom', u'if', u'see', u'see', u'cow', u'an', u'if', u'pig', u'hot', u'of', u'him', u'hen', u'we', u'hat', u'am', u'did', u'yes', u'did', u'and', u'day', u'hot', u'hat', u'toy', u'day', u'an', u'cow', u'big', u'no', u'pet', u'pet', u'you', u'hot', u'big', u'of', u'is', u'go', u'and', u'pig', u'but', u'my', u'pig', u'him', u'yes', u'he', u'and', u'man', u'am', u'mom', u'up', u'like', u'mom', u'we', u'an', u'my', u'of', u'not', u'he', u'in', u'it', u'in', u'toy', u'hen', u'bed', u'can', u'big', u'up', u'pig', u'red', u'rat', u'pig', u'hot', u'so', u'in', u'me', u'cow', u'man', u'yes', u'see', u'mom', u'mom', u'fat', u'to', u'for', u'is', u'am', u'of', u'my', u'to', u'bed', u'toy', u'like', u'me', u'man', u'up']"
2,grade1a,"['sound_look_alike', 'no_sound_look', 'sound_alike', 'sound_look_alike', 'sound_look_alike', 'sound_look_alike', 'sound_alike', 'no_sound_look', 'no_sound_look', 'no_sound_look', 'no_sound_look', 'sound_look_alike', 'sound_alike', 'no_sound_look', 'look_alike', 'sound_alike', 'sound_alike', 'sound_look_alike', 'no_sound_look', 'sound_alike', 'no_sound_look', 'sound_look_alike', 'sound_alike', 'sound_look_alike', 'look_alike', 'no_sound_look', 'sound_look_alike', 'look_alike', 'no_sound_look', 'sound_look_alike', 'look_alike', 'sound_alike', 'sound_look_alike', 'sound_alike', 'sound_alike', 'look_alike', 'look_alike', 'sound_look_alike', 'sound_look_alike', 'sound_alike', 'look_alike', 'look_alike', 'sound_alike', 'no_sound_look', 'sound_look_alike', 'sound_alike', 'sound_alike', 'look_alike', 'sound_look_alike', 'no_sound_look', 'sound_alike', 'no_sound_look', 'look_alike', 'look_alike', 'no_sound_look', 'sound_look_alike', 'sound_look_alike', 'no_sound_look', 'sound_look_alike', 'look_alike', 'sound_look_alike', 'no_sound_look', 'sound_alike', 'look_alike', 'look_alike', 'sound_look_alike', 'sound_alike', 'sound_alike', 'no_sound_look', 'look_alike', 'look_alike', 'sound_look_alike', 'sound_look_alike', 'sound_alike', 'sound_look_alike', 'no_sound_look', 'look_alike', 'sound_alike', 'no_sound_look', 'look_alike', 'sound_look_alike', 'sound_look_alike', 'sound_alike', 'sound_look_alike', 'no_sound_look', 'no_sound_look', 'sound_look_alike', 'sound_look_alike', 'sound_alike', 'sound_alike', 'no_sound_look', 'look_alike', 'look_alike', 'no_sound_look', 'no_sound_look', 'sound_look_alike', 'sound_look_alike', 'sound_alike', 'look_alike', 'look_alike']",,"['be', 'him', 'did', 'hen', 'of', 'if', 'if', 'his', 'his', 'him', 'be', 'him', 'hen', 'hot', 'of', 'be']","['bed', 'hen', 'man', 'her', 'toy', 'not', 'but', 'her', 'pet', 'hen']","['hat', 'hot', 'hat', 'big', 'hat', 'fat', 'rat', 'rat', 'not', 'fat', 'rat', 'hat', 'his', 'red', 'pig', 'bed', 'hat', 'his', 'pet', 'rat', 'him', 'fat', 'hot', 'day', 'hat', 'man', 'man', 'his']","['if', 'of', 'pig', 'rat', 'two', 'hot', 'hot', 'red', 'but', 'cow', 'for', 'mom', 'pig', 'two', 'two', 'pet', 'fat', 'man', 'yes', 'if', 'big', 'but', 'hat', 'but', 'hen', 'but', 'cow', 'hot', 'bed', 'yes', 'not', 'man', 'be', 'cow', 'rat', 'not', 'hot', 'but', 'fat', 'did', 'man', 'pig', 'toy', 'did', 'red', 'not', 'hen', 'his', 'big', 'her', 'bed', 'not', 'him', 'fat', 'did', 'did', 'bed', 'for', 'day', 'mom', 'hat', 'rat', 'but', 'yes', 'of', 'hot', 'pig', 'yes', 'red', 'but', 'hot', 'did', 'if', 'big', 'of', 'mom', 'for', 'him', 'man', 'mom', 'yes', 'day', 'hen', 'her', 'if', 'yes', 'yes', 'bed', 'if', 'yes', 'fat', 'for', 'cow', 'her', 'big', 'her', 'man', 'red', 'did', 'if', 'if', 'of', 'hat', 'his', 'if', 'two', 'hat', 'yes', 'mom', 'did', 'day', 'but', 'if', 'her', 'yes', 'pig', 'pet', 'did', 'him', 'pig', 'toy', 'but', 'be', 'for', 'him', 'hot', 'rat', 'for', 'big', 'if', 'red', 'hat', 'her', 'her', 'hat', 'fat', 'day', 'her', 'not', 'hot', 'two', 'for', 'his', 'if', 'of', 'yes', 'bed', 'man', 'not', 'yes', 'not', 'be', 'be', 'hot', 'day', 'cow', 'his', 'for', 'his', 'hat', 'rat', 'hen', 'pig', 'pig', 'did', 'pet', 'hen', 'yes', 'hat', 'cow', 'hen', 'rat', 'hot', 'yes', 'day', 'if', 'red', 'him', 'be', 'if', 'did', 'pet', 'cow', 'of', 'day', 'did', 'man', 'red', 'did', 'hat', 'pet', 'her', 'big', 'toy', 'big', 'of', 'cow', 'not', 'his', 'toy', 'hat', 'his', 'him', 'yes', 'hen', 'pet', 'his', 'him', 'cow', 'pet', 'pig', 'toy', 'did', 'day', 'be', 'mom', 'two', 'toy', 'cow', 'big', 'his', 'day', 'mom', 'of', 'mom', 'toy', 'big', 'big', 'hat', 'be', 'hot', 'toy', 'if', 'man', 'of', 'red', 'pet', 'day', 'hot', 'hen', 'bed', 'rat', 'bed', 'hat', 'her', 'hat', 'rat', 'big', 'but', 'red', 'rat', 'cow', 'toy', 'him', 'mom', 'of', 'mom', 'hot', 'bed', 'hot', 'fat', 'hat', 'hot', 'hat', 'hen', 'two', 'man', 'not', 'hat', 'him', 'man', 'two', 'her', 'but', 'her', 'pig', 'bed', 'hen', 'her', 'hat', 'did', 'but', 'man', 'yes', 'man', 'day', 'mom', 'bed', 'not', 'for', 'cow', 'but', 'of', 'be', 'big', 'pig', 'red', 'red', 'for', 'mom', 'his', 'day', 'man', 'pet', 'mom', 'man', 'but', 'pet', 'of', 'him', 'big', 'man', 'mom', 'hen', 'day', 'mom', 'two', 'but', 'toy', 'her', 'cow', 'day', 'cow', 'for', 'of', 'hen', 'if', 'did', 'of', 'cow', 'big', 'hat', 'mom', 'hat', 'for', 'yes', 'his', 'be', 'be', 'toy', 'hot', 'red', 'fat', 'day', 'be', 'hat', 'two', 'but', 'hot', 'hat', 'if', 'day', 'big', 'cow', 'him', 'fat', 'yes', 'day', 'two', 'pet', 'rat', 'hat', 'mom', 'rat', 'mom', 'man', 'of', 'hat', 'for', 'pet', 'him', 'mom', 'pet', 'him', 'be', 'pet', 'hot', 'red', 'him', 'be', 'not', 'fat', 'pig', 'of', 'bed', 'pig', 'if', 'hen', 'not', 'if', 'fat', 'big', 'not', 'bed', 'not', 'her', 'mom', 'hot', 'rat', 'fat', 'but', 'for', 'but', 'hot', 'fat', 'for', 'bed', 'toy', 'pet', 'fat', 'his', 'hen', 'hot', 'cow', 'of', 'of', 'for', 'did', 'of', 'big', 'cow', 'mom', 'of', 'fat', 'not', 'yes', 'for', 'of', 'did', 'red', 'pig', 'rat', 'man', 'but', 'red', 'her', 'be', 'two', 'if', 'her', 'man', 'hen', 'red', 'fat', 'yes', 'man', 'if', 'cow', 'of', 'him', 'toy', 'be', 'big', 'him', 'his', 'if', 'for', 'fat', 'pig', 'did', 'red', 'man', 'toy', 'of', 'not', 'yes', 'toy', 'not', 'mom', 'him', 'pet', 'his', 'mom', 'hot', 'pet', 'toy', 'did', 'bed', 'cow', 'of', 'toy', 'for', 'pig', 'bed', 'hat', 'hen', 'if', 'rat', 'of', 'bed', 'be', 'pet', 'big', 'mom', 'of', 'bed', 'fat', 'mom', 'him']","[u'see', u'this', u'this', u'his', u'up', u'it', u'is', u'he', u'hen', u'hen', u'me', u'he', u'him', u'had', u'us', u'we']","[u'be', u'her', u'may', u'he', u'to', u'no', u'out', u'hen', u'pat', u'he']","[u'fat', u'not', u'rat', u'pig', u'pat', u'rat', u'at', u'fat', u'hot', u'hat', u'hat', u'hot', u'is', u'bed', u'big', u'red', u'had', u'him', u'get', u'pat', u'his', u'pat', u'hat', u'may', u'at', u'can', u'an', u'this']","[u'her', u'my', u'at', u'red', u'box', u'of', u'can', u'my', u'us', u'mom', u'mom', u'an', u'her', u'pig', u'my', u'this', u'will', u'yes', u'day', u'him', u'into', u'sun', u'big', u'if', u'no', u'and', u'us', u'am', u'of', u'oh', u'we', u'see', u'hot', u'look', u'and', u'into', u'hen', u'he', u'come', u'fat', u'came', u'you', u'yes', u'sun', u'me', u'mom', u'pool', u'pet', u'this', u'one', u'not', u'at', u'not', u'into', u'us', u'on', u'toy', u'it', u'hot', u'go', u'his', u'get', u'she', u'may', u'bed', u'box', u'its', u'ride', u'it', u'pet', u'he', u'like', u'one', u'and', u'get', u'look', u'fat', u'mom', u'on', u'and', u'so', u'pet', u'for', u'but', u'the', u'at', u'was', u'but', u'ride', u'pig', u'like', u'but', u'was', u'the', u'in', u'man', u'mom', u'day', u'my', u'you', u'up', u'him', u'can', u'us', u'pool', u'him', u'box', u'be', u'at', u'hen', u'at', u'hen', u'she', u'sun', u'not', u'so', u'can', u'ride', u'up', u'was', u'pet', u'mom', u'pool', u'hot', u'and', u'at', u'to', u'toy', u'we', u'day', u'us', u'did', u'at', u'if', u'my', u'pig', u'an', u'yes', u'will', u'so', u'she', u'am', u'came', u'mom', u'pool', u'red', u'play', u'it', u'on', u'box', u'came', u'up', u'pet', u'six', u'so', u'his', u'yes', u'all', u'mom', u'two', u'am', u'red', u'pool', u'hot', u'see', u'up', u'in', u'it', u'may', u'can', u'go', u'ride', u'fat', u'pet', u'pat', u'get', u'was', u'its', u'day', u'hot', u'box', u'so', u'oh', u'big', u'book', u'all', u'but', u'see', u'no', u'us', u'him', u'pet', u'oh', u'ride', u'so', u'to', u'pool', u'her', u'she', u'hen', u'play', u'am', u'had', u'six', u'did', u'man', u'hot', u'see', u'not', u'yes', u'all', u'me', u'come', u'sun', u'rat', u'toy', u'pet', u'out', u'at', u'hot', u'pat', u'us', u'did', u'cow', u'fat', u'this', u'she', u'mom', u'me', u'play', u'the', u'can', u'play', u'in', u'into', u'oh', u'her', u'him', u'me', u'we', u'yes', u'day', u'did', u'come', u'had', u'to', u'an', u'will', u'can', u'toy', u'but', u'had', u'look', u'into', u'ride', u'oh', u'into', u'see', u'he', u'bed', u'us', u'its', u'we', u'six', u'bed', u'hat', u'not', u'big', u'for', u'big', u'did', u'in', u'get', u'we', u'all', u'not', u'seek', u'man', u'seek', u'and', u'he', u'all', u'hot', u'cow', u'is', u'six', u'us', u'she', u'book', u'to', u'no', u'ride', u'if', u'did', u'seek', u'up', u'if', u'get', u'into', u'it', u'the', u'his', u'out', u'she', u'to', u'cow', u'pat', u'hen', u'ride', u'pet', u'it', u'the', u'two', u'this', u'came', u'man', u'hen', u'get', u'us', u'not', u'rat', u'go', u'pet', u'ride', u'two', u'hat', u'on', u'was', u'go', u'her', u'you', u'cow', u'so', u'all', u'hat', u'in', u'in', u'like', u'may', u'hat', u'one', u'mom', u'six', u'had', u'but', u'man', u'can', u'to', u'seek', u'sun', u'did', u'not', u'my', u'an', u'you', u'man', u'me', u'he', u'this', u'is', u'hen', u'hen', u'pet', u'if', u'red', u'get', u'out', u'am', u'on', u'into', u'us', u'but', u'pig', u'on', u'ride', u'bed', u'up', u'be', u'pat', u'in', u'did', u'the', u'my', u'is', u'out', u'is', u'so', u'see', u'two', u'had', u'am', u'may', u'hat', u'her', u'out', u'him', u'he', u'in', u'cow', u'play', u'day', u'pig', u'at', u'is', u'book', u'can', u'big', u'get', u'all', u'out', u'be', u'toy', u'pat', u'go', u'mom', u'red', u'this', u'hat', u'his', u'did', u'the', u'pig', u'not', u'yes', u'play', u'man', u'is', u'may', u'me', u'at', u'for', u'big', u'for', u'his', u'one', u'box', u'not', u'for', u'sun', u'this', u'book', u'but', u'pig', u'oh', u'us', u'oh', u'he', u'seek', u'did', u'ride', u'seek', u'get', u'be', u'of', u'me', u'me', u'red', u'red', u'came', u'its', u'we', u'toy', u'hot', u'hat', u'hen', u'like', u'but', u'of', u'see', u'rat', u'look', u'toy', u'my', u'but', u'hot', u'no', u'red', u'mom', u'of', u'this', u'in', u'go', u'hen', u'its', u'day', u'play', u'look', u'not', u'for', u'to', u'this', u'two', u'see', u'its', u'no', u'him', u'two', u'if', u'it']"
