Difficulty,Grade,Criteria,Target_4button,Target_sound_alike,Target_look_alike,Target_sound_look_alike,Target_no_sound_look,Foil_sound_alike,Foil_look_alike,Foil_sound_look_alike,Foil_no_sound_look
3,grade1b,"['sound_alike', 'sound_look_alike', 'look_alike', 'look_alike', 'look_alike', 'look_alike', 'sound_look_alike', 'look_alike', 'no_sound_look', 'look_alike', 'look_alike', 'sound_alike', 'no_sound_look', 'no_sound_look', 'look_alike', 'no_sound_look', 'look_alike', 'no_sound_look', 'look_alike', 'sound_alike', 'sound_look_alike', 'sound_look_alike', 'no_sound_look', 'sound_look_alike', 'sound_look_alike', 'look_alike', 'sound_look_alike', 'sound_alike', 'no_sound_look', 'look_alike', 'look_alike', 'sound_look_alike', 'no_sound_look', 'no_sound_look', 'sound_look_alike', 'sound_look_alike', 'sound_look_alike', 'no_sound_look', 'sound_look_alike', 'look_alike', 'sound_alike', 'sound_alike', 'sound_look_alike', 'sound_look_alike', 'no_sound_look', 'sound_look_alike', 'sound_alike', 'look_alike', 'look_alike', 'no_sound_look', 'sound_look_alike', 'no_sound_look', 'look_alike', 'sound_look_alike', 'no_sound_look', 'no_sound_look', 'look_alike', 'sound_look_alike', 'sound_alike', 'sound_look_alike', 'sound_look_alike', 'look_alike', 'sound_alike', 'sound_alike', 'sound_alike', 'sound_look_alike', 'sound_look_alike', 'look_alike', 'sound_look_alike', 'no_sound_look', 'no_sound_look', 'no_sound_look', 'look_alike', 'sound_look_alike', 'sound_alike', 'no_sound_look', 'sound_alike', 'look_alike', 'look_alike', 'no_sound_look', 'sound_alike', 'sound_look_alike', 'no_sound_look', 'no_sound_look', 'sound_look_alike', 'look_alike', 'look_alike', 'no_sound_look', 'look_alike', 'no_sound_look', 'sound_alike', 'look_alike', 'no_sound_look', 'no_sound_look', 'no_sound_look', 'look_alike', 'sound_look_alike', 'look_alike', 'sound_look_alike', 'sound_alike']",,"['come', 'one', 'one', 'one', 'she', 'come', 'may', 'sun', 'had', 'had', 'sun', 'she', 'one']","['had', 'will', 'may', 'had', 'will', 'had', 'came', 'six', 'get', 'this', 'was', 'out', 'out', 'out', 'had', 'was', 'box', 'come', 'may', 'out', 'was', 'may', 'was', 'was', 'may', 'may', 'may', 'one', 'may', 'may', 'come', 'ride', 'she']","['get', 'book', 'get', 'had', 'all', 'all', 'will', 'all', 'play', 'will', 'all', 'sun', 'us', 'came', 'come', 'six', 'came', 'get', 'had', 'all', 'play', 'look', 'came', 'came', 'get', 'box', 'sun']","['ride', 'us', 'will', 'play', 'one', 'come', 'ride', 'may', 'six', 'get', 'had', 'play', 'box', 'into', 'had', 'box', 'its', 'out', 'this', 'play', 'box', 'book', 'out', 'its', 'had', 'oh', 'had', 'play', 'us', 'one', 'came', 'came', 'into', 'all', 'one', 'us', 'one', 'out', 'came', 'sun', 'may', 'came', 'she', 'had', 'into', 'its', 'us', 'she', 'this', 'out', 'book', 'play', 'oh', 'play', 'out', 'this', 'will', 'six', 'will', 'oh', 'came', 'box', 'look', 'came', 'came', 'may', 'oh', 'play', 'she', 'sun', 'ride', 'had', 'out', 'all', 'play', 'will', 'six', 'look', 'will', 'this', 'was', 'box', 'all', 'book', 'was', 'get', 'oh', 'box', 'six', 'ride', 'had', 'this', 'this', 'came', 'came', 'six', 'was', 'oh', 'will', 'she', 'look', 'one', 'us', 'was', 'this', 'box', 'its', 'play', 'this', 'was', 'oh', 'book', 'she', 'she', 'out', 'get', 'us', 'one', 'us', 'this', 'ride', 'its', 'she', 'into', 'she', 'six', 'play', 'was', 'she', 'all', 'all', 'oh', 'six', 'us', 'box', 'ride', 'all', 'she', 'this', 'may', 'all', 'had', 'sun', 'get', 'may', 'this', 'six', 'six', 'box', 'had', 'get', 'us', 'box', 'look', 'box', 'may', 'come', 'sun', 'look', 'six', 'box', 'box', 'one', 'into', 'may', 'all', 'oh', 'may', 'play', 'us', 'six', 'had', 'she', 'us', 'play', 'will', 'into', 'its', 'out', 'come', 'out', 'come', 'ride', 'sun', 'come', 'was', 'out', 'will', 'its', 'all', 'ride', 'will', 'all', 'box', 'oh', 'its', 'oh', 'will', 'this', 'box', 'into', 'sun', 'will', 'had', 'she', 'had', 'will', 'oh', 'sun', 'she', 'came', 'us', 'will', 'this', 'sun', 'ride', 'box', 'will', 'box', 'six', 'box', 'its', 'all', 'six', 'book', 'will', 'box', 'had', 'all', 'six', 'one', 'out', 'us', 'six', 'box', 'will', 'was', 'came', 'come', 'book', 'one', 'come', 'sun', 'box', 'book', 'come', 'sun', 'this', 'had', 'this', 'six', 'out', 'this', 'out', 'this', 'six', 'six', 'box', 'all', 'she', 'she', 'play', 'out', 'book', 'us', 'sun', 'she', 'all', 'its', 'she', 'had', 'its', 'sun', 'play', 'had', 'come', 'came', 'ride', 'its', 'box', 'one', 'had', 'book', 'one', 'will', 'six', 'may', 'into', 'us', 'into', 'play', 'come', 'all', 'six', 'into', 'box', 'will', 'play', 'its', 'all', 'six', 'ride', 'play', 'box', 'this', 'had', 'was', 'six', 'six', 'may', 'this', 'sun', 'ride', 'come', 'box', 'was', 'was', 'look', 'play', 'get', 'came', 'she', 'book', 'get', 'oh', 'us', 'get', 'all', 'may', 'ride', 'may', 'get', 'come', 'had', 'out', 'may', 'had', 'us', 'get', 'had', 'may', 'may', 'was', 'sun', 'get', 'get', 'all', 'box', 'six', 'oh', 'out', 'come', 'play', 'came', 'its', 'this', 'into', 'had', 'one', 'get', 'box', 'all', 'oh', 'look', 'was', 'play', 'she', 'sun', 'get', 'she', 'us', 'will', 'us', 'get', 'box', 'came', 'oh', 'may', 'had', 'may', 'out', 'ride', 'this', 'get', 'its', 'ride', 'look', 'us', 'into', 'she', 'sun', 'box', 'us', 'its', 'had', 'came', 'may', 'ride', 'ride', 'six', 'us', 'she', 'out', 'oh', 'will', 'had', 'box', 'its', 'six', 'look', 'oh', 'she', 'this', 'will', 'us', 'six', 'look', 'was', 'oh', 'may', 'this', 'us', 'six', 'book', 'look', 'out', 'one', 'this', 'had', 'into', 'come', 'sun', 'out', 'us', 'into', 'six', 'its', 'one', 'one', 'had', 'come', 'out', 'us', 'play', 'sun', 'play', 'six', 'into', 'she', 'play', 'us', 'get', 'one', 'us', 'us', 'six', 'she', 'look', 'get', 'into', 'one', 'look', 'one', 'box', 'had', 'out', 'she', 'had', 'play', 'come', 'into', 'book', 'she', 'sun', 'all', 'book', 'box', 'one', 'look', 'book', 'look', 'get', 'came', 'this', 'may', 'us', 'book', 'box', 'ride', 'one', 'book', 'was', 'sun', 'oh', 'ride', 'play', 'out', 'may', 'out']","[u'cup', u'sun', u'when', u'run', u'sea', u'cut', u'make', u'one', u'have', u'hide', u'some', u'sheep', u'what']","[u'mad', u'hill', u'way', u'hid', u'wall', u'dad', u'come', u'sit', u'got', u'his', u'gas', u'but', u'nut', u'put', u'bad', u'way', u'boy', u'home', u'man', u'our', u'wash', u'many', u'has', u'as', u'lay', u'say', u'day', u'gone', u'mad', u'pay', u'came', u'hide', u'shoe']","[u'met', u'look', u'pet', u'hat', u'ball', u'wall', u'well', u'call', u'pay', u'bill', u'fall', u'run', u'bus', u'cake', u'some', u'fix', u'game', u'yet', u'has', u'tall', u'lay', u'book', u'same', u'name', u'let', u'fox', u'fun']","[u'dress', u'four', u'then', u'will', u'candy', u'bat', u'nut', u'its', u'ran', u'sun', u'sun', u'of', u'wash', u'bed', u'box', u'big', u'tell', u'fat', u'car', u'top', u'name', u'were', u'eating', u'play', u'hit', u'today', u'stay', u'rabbit', u'thing', u'fat', u'who', u'be', u'fox', u'first', u'seek', u'each', u'dad', u'page', u'not', u'ago', u'did', u'child', u'sky', u'could', u'us', u'change', u'post', u'fall', u'bike', u'fall', u'stop', u'ball', u'hill', u'why', u'all', u'game', u'put', u'going', u'about', u'truck', u'drive', u'four', u'who', u'city', u'help', u'have', u'seven', u'seat', u'plant', u'sheep', u'hot', u'after', u'boy', u'late', u'shoe', u'father', u'blue', u'him', u'get', u'ride', u'brown', u'for', u'many', u'what', u'dog', u'play', u'been', u'bee', u'your', u'could', u'today', u'big', u'wood', u'seat', u'daddy', u'after', u'jump', u'brown', u'them', u'cat', u'zoo', u'give', u'coming', u'week', u'base', u'thing', u'grass', u'black', u'ball', u'from', u'her', u'page', u'got', u'run', u'wood', u'grass', u'box', u'white', u'glad', u'milk', u'sheep', u'walk', u'hide', u'club', u'are', u'mother', u'feel', u'ran', u'book', u'fly', u'hat', u'sea', u'yet', u'went', u'look', u'not', u'feed', u'good', u'light', u'went', u'daddy', u'from', u'girl', u'they', u'zoo', u'ate', u'find', u'are', u'snow', u'got', u'rabbit', u'walk', u'deep', u'both', u'very', u'deer', u'try', u'not', u'outside', u'be', u'sea', u'first', u'rain', u'fish', u'gold', u'tax', u'nine', u'fun', u'candy', u'this', u'our', u'when', u'try', u'ate', u'hid', u'funny', u'about', u'corn', u'pat', u'today', u'met', u'gave', u'goat', u'back', u'well', u'cut', u'tall', u'could', u'girl', u'well', u'night', u'of', u'not', u'story', u'from', u'give', u'green', u'said', u'cake', u'nail', u'bat', u'stop', u'tree', u'too', u'hen', u'any', u'came', u'red', u'two', u'bike', u'been', u'daddy', u'very', u'city', u'stay', u'girl', u'bike', u'been', u'lay', u'got', u'were', u'plant', u'glad', u'base', u'car', u'sit', u'most', u'only', u'but', u'light', u'seem', u'outside', u'way', u'name', u'hat', u'had', u'yet', u'has', u'funny', u'thing', u'men', u'ten', u'fast', u'from', u'thank', u'night', u'train', u'worn', u'house', u'farm', u'seem', u'pull', u'been', u'oh', u'how', u'glad', u'they', u'view', u'fish', u'or', u'ride', u'snow', u'bike', u'seek', u'came', u'how', u'by', u'sang', u'who', u'going', u'pool', u'ten', u'jump', u'ten', u'ride', u'sky', u'black', u'club', u'of', u'week', u'way', u'father', u'here', u'store', u'mad', u'three', u'riding', u'how', u'coat', u'over', u'say', u'after', u'nail', u'part', u'coming', u'pull', u'north', u'take', u'open', u'thank', u'drop', u'some', u'both', u'them', u'inch', u'other', u'thank', u'eating', u'time', u'cut', u'mile', u'far', u'four', u'boy', u'last', u'name', u'one', u'ride', u'red', u'brother', u'said', u'sleep', u'tell', u'there', u'will', u'seem', u'very', u'fix', u'leg', u'jump', u'moon', u'night', u'dress', u'red', u'open', u'rain', u'gas', u'its', u'yes', u'all', u'must', u'goat', u'after', u'your', u'cup', u'cake', u'rock', u'today', u'egg', u'doll', u'tree', u'drop', u'child', u'ask', u'out', u'drop', u'floor', u'snow', u'duck', u'name', u'gone', u'view', u'after', u'base', u'come', u'been', u'us', u'bill', u'while', u'deer', u'first', u'corn', u'stop', u'our', u'yet', u'gave', u'why', u'fast', u'same', u'night', u'seek', u'post', u'home', u'tax', u'mom', u'what', u'cut', u'toy', u'game', u'fix', u'blue', u'duck', u'bad', u'too', u'fox', u'club', u'last', u'snow', u'rain', u'today', u'they', u'sun', u'be', u'wet', u'glad', u'name', u'plant', u'new', u'thank', u'there', u'sun', u'black', u'egg', u'work', u'start', u'been', u'run', u'men', u'sat', u'father', u'here', u'red', u'seek', u'black', u'its', u'corn', u'lake', u'end', u'little', u'gone', u'from', u'dog', u'not', u'rock', u'well', u'lake', u'one', u'boy', u'shoe', u'riding', u'saw', u'by', u'city', u'look', u'fox', u'meat', u'know', u'bill', u'apple', u'stay', u'only', u'yellow', u'jump', u'ago', u'said', u'floor', u'about', u'all', u'went', u'truck', u'may', u'before', u'cake', u'day', u'dog', u'walk', u'thank', u'let', u'out', u'stay', u'open', u'coming', u'into', u'truck', u'now', u'today', u'know', u'his', u'bad', u'green', u'seat', u'when', u'say', u'cow', u'eat', u'six', u'child', u'send', u'got', u'did', u'will', u'pay', u'sleep', u'our', u'box', u'hop', u'road', u'bee', u'food']"
4,grade2,,"['been', 'far', 'there', 'there', 'what', 'meat', 'been', 'sat', 'hill', 'seat', 'night', 'night', 'there', 'there', 'have', 'there', 'car', 'been', 'seat', 'there', 'well', 'seat', 'meat', 'fall', 'seat', 'ten', 'seat', 'seat', 'seat', 'shoe', 'have', 'seat', 'there', 'bat', 'seat', 'have', 'way', 'feel', 'seat', 'have', 'sat', 'seat', 'met', 'got', 'down', 'foot', 'hill', 'sat', 'deer', 'seat', 'sat', 'seat', 'when', 'seat', 'have', 'night', 'back', 'have', 'hill', 'there', 'there', 'have', 'wall', 'there', 'seat', 'night', 'eat', 'could', 'what', 'have', 'seat', 'seat', 'have', 'good', 'have', 'hill', 'them', 'cat', 'seat', 'seat', 'meat', 'sat', 'hide', 'hill', 'there', 'night', 'what', 'there', 'there', 'bus', 'seat', 'have', 'have', 'here', 'been', 'mile', 'some', 'there', 'four', 'seat', 'went', 'seat', 'hill', 'your', 'door', 'meat', 'have', 'there', 'five', 'fine', 'there', 'what', 'what', 'hill', 'there', 'have', 'there', 'what', 'have', 'night', 'been', 'there', 'night', 'there', 'what', 'are', 'there', 'bill', 'there', 'there', 'been', 'sat', 'seat', 'meat', 'meat', 'there', 'snow', 'hill', 'have', 'there', 'same', 'there', 'how', 'been', 'have', 'ran', 'been', 'lay', 'late', 'have', 'have', 'have', 'have', 'have', 'have', 'then', 'have', 'sat', 'seat', 'rain', 'there', 'sat', 'seat', 'tell', 'wood', 'seat', 'house', 'have', 'goat', 'many', 'what', 'night', 'have', 'meat', 'have', 'light', 'hid', 'eating', 'very', 'seat', 'meat']",,,,,"[u'bill', u'four', u'hair', u'then', u'cut', u'might', u'win', u'pat', u'hid', u'wheat', u'write', u'knife', u'them', u'then', u'had', u'then', u'are', u'win', u'seek', u'them', u'when', u'seek', u'might', u'four', u'feet', u'when', u'feet', u'wheat', u'wheat', u'who', u'half', u'wheat', u'hair', u'pat', u'feet', u'half', u'wait', u'real', u'feet', u'has', u'bat', u'seek', u'let', u'lot', u'done', u'put', u'hid', u'bat', u'year', u'wheat', u'pat', u'feet', u'one', u'feet', u'has', u'knife', u'bag', u'half', u'hit', u'hair', u'hair', u'has', u'while', u'them', u'feet', u'knife', u'feet', u'wood', u'cut', u'half', u'seek', u'seek', u'had', u'would', u'half', u'hid', u'their', u'sat', u'wheat', u'wheat', u'feet', u'bat', u'had', u'hid', u'then', u'write', u'cut', u'them', u'hair', u'us', u'wheat', u'has', u'has', u'heat', u'win', u'might', u'sun', u'hair', u'fall', u'wheat', u'when', u'feet', u'hit', u'door', u'dog', u'might', u'half', u'them', u'fight', u'fight', u'them', u'cut', u'one', u'hit', u'then', u'had', u'then', u'one', u'has', u'write', u'win', u'hair', u'write', u'then', u'one', u'art', u'hair', u'been', u'them', u'hair', u'bill', u'bat', u'seek', u'feet', u'feet', u'then', u'sew', u'hit', u'had', u'them', u'seem', u'then', u'house', u'bill', u'half', u'run', u'bill', u'late', u'lay', u'has', u'has', u'had', u'half', u'has', u'had', u'their', u'had', u'pat', u'seek', u'race', u'them', u'pat', u'seek', u'ten', u'could', u'feet', u'how', u'had', u'goes', u'merry', u'one', u'knife', u'had', u'feet', u'half', u'line', u'hill', u'sitting', u'merry', u'seek', u'might']","[u'seen', u'fair', u'these', u'these', u'that', u'met', u'bee', u'seat', u'will', u'heat', u'tonight', u'eight', u'these', u'where', u'save', u'these', u'care', u'bee', u'heat', u'these', u'wall', u'sat', u'heat', u'full', u'set', u'then', u'set', u'set', u'sat', u'shot', u'cave', u'sat', u'these', u'boat', u'set', u'cave', u'away', u'fell', u'heat', u'gave', u'salt', u'heat', u'meat', u'goat', u'own', u'food', u'bill', u'seat', u'deep', u'heat', u'seat', u'heat', u'then', u'heat', u'cave', u'tonight', u'bank', u'gave', u'will', u'these', u'where', u'gave', u'will', u'these', u'sat', u'tonight', u'heat', u'cold', u'wheat', u'gave', u'sat', u'heat', u'gave', u'food', u'save', u'bill', u'they', u'coat', u'sat', u'set', u'met', u'salt', u'ride', u'will', u'where', u'tonight', u'that', u'where', u'where', u'busy', u'set', u'cave', u'save', u'where', u'seen', u'milk', u'home', u'three', u'our', u'heat', u'want', u'sat', u'will', u'hour', u'poor', u'met', u'save', u'three', u'fire', u'fire', u'three', u'wheat', u'that', u'bill', u'three', u'cave', u'where', u'wheat', u'gave', u'eight', u'seen', u'three', u'eight', u'these', u'wheat', u'care', u'where', u'hill', u'where', u'three', u'bee', u'seat', u'set', u'met', u'heat', u'three', u'now', u'bill', u'save', u'where', u'some', u'three', u'show', u'bee', u'save', u'rain', u'seen', u'lady', u'later', u'save', u'save', u'cave', u'gave', u'cave', u'save', u'when', u'gave', u'salt', u'set', u'ran', u'three', u'salt', u'sat', u'tall', u'food', u'sat', u'horse', u'gave', u'got', u'may', u'that', u'eight', u'cave', u'heat', u'cave', u'eight', u'hide', u'reading', u'every', u'set', u'heat']","['', u'farm', '', '', '', u'seat', '', '', '', u'meat', u'light', u'sight', '', '', '', '', '', '', u'meat', '', u'tell', u'eat', u'seat', u'tall', u'eat', '', u'meat', u'meat', u'meat', u'show', '', u'sea', '', '', u'sea', '', '', u'feed', u'sea', '', '', u'eat', '', '', '', '', '', '', '', u'sea', '', u'eat', '', u'meat', '', u'light', u'black', '', '', '', '', '', u'all', '', u'meat', u'sight', u'meat', u'would', '', '', u'sea', u'sea', '', u'wood', '', '', u'then', '', u'eat', u'eat', u'seat', '', '', '', '', u'sight', '', '', '', '', u'sea', '', '', '', '', u'mine', u'come', '', u'your', u'eat', u'wet', u'eat', '', u'four', '', u'eat', '', '', u'fine', u'find', '', '', '', '', '', '', '', '', '', u'sight', '', '', u'light', '', '', '', '', u'will', '', '', '', '', u'eat', u'eat', u'eat', '', u'know', '', '', '', u'came', '', '', '', '', '', '', u'play', u'ate', '', '', '', '', '', '', u'them', '', '', u'meat', u'train', '', '', u'meat', u'fell', u'good', u'sea', '', '', u'boat', u'any', '', u'light', '', u'seat', '', u'right', '', '', '', u'sea', u'eat']","[u'meat', '', u'almost', u'home', u'always', '', u'by', u'forgot', u'broke', '', '', '', u'almost', u'almost', u'little', u'school', u'try', u'meat', '', u'home', '', '', '', '', '', u'pat', '', '', '', '', u'hide', '', u'home', u'coming', '', u'ever', u'mail', '', '', u'hide', u'forgot', '', u'club', u'morning', u'both', u'just', u'broke', u'lost', u'fast', '', u'lost', '', u'thank', '', u'little', '', '', u'ever', u'last', u'school', u'school', u'little', '', u'school', '', '', '', '', u'always', u'hide', '', '', u'little', '', u'little', u'last', '', u'page', '', '', '', u'lost', u'met', u'last', u'home', '', u'less', u'school', u'almost', u'hole', '', u'hide', u'ever', u'third', u'meat', '', '', u'almost', '', '', '', '', u'broke', '', u'sun', '', u'ever', u'school', '', '', u'home', u'less', u'always', u'last', u'school', u'little', u'school', u'less', u'ever', '', u'by', u'home', '', u'almost', u'always', u'box', u'home', '', u'almost', u'school', u'by', u'forgot', '', '', '', u'almost', '', u'broke', u'hide', u'home', '', u'home', u'walk', u'meat', u'hide', u'bird', u'by', '', '', u'hide', u'little', u'hide', u'little', u'ever', u'ever', '', u'ever', u'lost', '', '', u'almost', u'forgot', '', '', '', '', u'should', u'hide', '', '', u'less', '', u'ever', '', u'little', '', u'now', u'hundred', u'feed', '', '']"
5,grade3,,"['hold', 'right', 'where', 'where', 'eight', 'bear', 'care', 'being', 'where', 'eight', 'won', 'wheat', 'hair', 'pair', 'show', 'cover', 'wheat', 'hair', 'lot', 'anything', 'hair', 'where', 'taking', 'move', 'seen', 'show', 'head', 'later', 'bought', 'show', 'bought', 'fair', 'reading', 'where', 'head', 'bought', 'hair', 'hair', 'write', 'where', 'wheat', 'show', 'would', 'save', 'where', 'fair', 'hair', 'teeth', 'hair', 'cold', 'working', 'bought', 'hair', 'head', 'where', 'hair', 'boat', 'hair', 'where', 'word', 'near', 'show', 'where', 'hair', 'fair', 'side', 'bought', 'bought', 'head', 'head', 'fair', 'year', 'hair', 'hair', 'bought', 'show', 'hair', 'wheat', 'hair', 'poor', 'where', 'bought', 'hard', 'goes', 'show', 'more', 'hair', 'where', 'eight', 'might', 'wheat', 'where', 'hair', 'full', 'hair', 'heat', 'where', 'where', 'eight', 'eight', 'set', 'hair', 'fight', 'hope', 'song', 'where', 'where', 'hair', 'wait', 'hair', 'where', 'sent', 'hair', 'hair', 'fair', 'hair', 'where', 'where', 'foot', 'hair', 'buy', 'fair', 'where', 'wheat', 'eight', 'head', 'head', 'form', 'where', 'sight', 'fair', 'eight', 'show', 'where', 'eight', 'air', 'hair', 'taken', 'fell', 'where', 'hair', 'feet', 'fair', 'where', 'where', 'where', 'own', 'wheat', 'wheat', 'does', 'done', 'head', 'face']",,,,,"[u'whole', u'white', u'pair', u'wet', u'late', u'fair', u'air', u'feeling', u'wet', u'wait', u'done', u'white', u'there', u'wear', u'though', u'color', u'white', u'head', u'got', u'everything', u'their', u'pair', u'taken', u'moon', u'sea', u'though', u'hair', u'letter', u'caught', u'sew', u'bat', u'fell', u'running', u'air', u'hair', u'bat', u'there', u'their', u'fight', u'air', u'week', u'sew', u'good', u'say', u'air', u'bear', u'head', u'teach', u'head', u'coal', u'taking', u'bat', u'head', u'hid', u'air', u'their', u'wrote', u'head', u'pair', u'bird', u'deer', u'sew', u'air', u'their', u'bear', u'sight', u'bat', u'caught', u'hid', u'hair', u'fell', u'deer', u'head', u'head', u'caught', u'though', u'head', u'white', u'there', u'put', u'air', u'caught', u'heart', u'goat', u'sew', u'four', u'there', u'air', u'late', u'white', u'week', u'wet', u'there', u'wool', u'their', u'here', u'wet', u'pair', u'wait', u'late', u'wet', u'there', u'fine', u'whole', u'wrong', u'wet', u'wet', u'there', u'late', u'their', u'pair', u'meant', u'their', u'head', u'bear', u'their', u'wet', u'wet', u'full', u'there', u'bike', u'fell', u'pair', u'week', u'wait', u'hid', u'hair', u'four', u'pair', u'side', u'fell', u'wait', u'though', u'air', u'late', u'care', u'there', u'taking', u'fair', u'pair', u'their', u'fight', u'bear', u'air', u'pair', u'wet', u'known', u'white', u'week', u'duck', u'run', u'hid', u'base']","[u'gold', u'eight', u'here', u'there', u'might', u'year', u'cave', u'bring', u'were', u'sight', u'worn', u'what', u'air', u'hair', u'how', u'over', u'what', u'fair', u'lost', u'nothing', u'pair', u'were', u'walking', u'more', u'seven', u'shot', u'hear', u'water', u'thought', u'shot', u'thought', u'hair', u'eating', u'here', u'heat', u'brought', u'air', u'air', u'wrote', u'were', u'heat', u'how', u'world', u'have', u'there', u'far', u'fair', u'tenth', u'pair', u'hold', u'looking', u'thought', u'air', u'heat', u'there', u'air', u'bat', u'fair', u'here', u'worn', u'bear', u'how', u'here', u'pair', u'hair', u'hide', u'brought', u'thought', u'hear', u'heat', u'far', u'wear', u'air', u'air', u'brought', u'how', u'pair', u'heat', u'pair', u'door', u'were', u'brought', u'yard', u'does', u'shot', u'move', u'air', u'here', u'might', u'eight', u'what', u'here', u'fair', u'fall', u'air', u'meat', u'were', u'were', u'might', u'sight', u'seat', u'pair', u'eight', u'hop', u'sing', u'were', u'here', u'fair', u'want', u'fair', u'here', u'seat', u'fair', u'pair', u'hair', u'fair', u'there', u'there', u'food', u'pair', u'busy', u'far', u'there', u'what', u'might', u'hear', u'hear', u'from', u'were', u'eight', u'hair', u'sight', u'shot', u'were', u'sight', u'hair', u'fair', u'take', u'feel', u'there', u'pair', u'felt', u'far', u'there', u'there', u'here', u'town', u'heat', u'heat', u'goes', u'gone', u'heat', u'fact']","[u'hole', u'light', '', '', '', u'wear', u'scare', '', '', '', '', '', '', u'air', u'shoe', '', '', '', '', '', '', '', u'talking', '', u'seem', u'shoe', u'heard', '', '', u'snow', '', u'pair', u'riding', '', u'heard', '', '', '', u'white', '', '', u'shoe', u'could', u'same', '', u'pair', '', '', '', u'gold', u'walking', '', '', u'held', '', '', u'coat', '', '', u'world', u'dear', u'snow', '', '', u'air', '', '', '', u'heard', u'held', u'pair', u'dear', '', '', '', u'snow', '', '', '', '', '', '', '', '', u'shoe', '', '', '', '', u'right', '', '', '', u'pull', '', u'hear', '', '', '', '', u'sent', '', u'sight', u'hole', u'sang', '', '', '', '', '', '', u'set', '', '', u'pair', '', '', '', '', '', '', u'air', '', '', '', u'held', u'held', u'farm', '', u'night', u'air', '', u'snow', '', '', u'fair', '', '', u'felt', '', '', u'feel', u'air', '', '', '', '', '', '', '', '', u'heard', u'race']","['', '', u'call', u'together', u'chicken', '', '', u'hop', u'leg', u'corn', u'better', u'talk', u'sister', '', '', u'got', u'bag', u'sister', u'right', u'away', u'sister', u'together', '', u'never', '', '', '', u'teeth', u'stand', '', u'house', '', '', u'call', '', u'stand', u'mad', u'sister', '', u'together', u'talk', '', '', '', u'call', '', u'twenty', u'might', u'mad', '', '', u'stand', u'mad', '', u'together', u'twenty', '', u'mad', u'together', '', '', '', u'leg', u'twenty', '', u'seat', u'house', u'house', '', '', '', '', u'twenty', u'sister', u'stand', '', u'sister', u'bag', u'sister', u'written', u'leg', u'house', u'held', u'lunch', '', u'song', u'twenty', u'together', u'corn', '', u'bag', u'call', u'twenty', '', u'mad', '', u'call', u'leg', u'corn', u'chicken', '', u'twenty', '', '', '', u'together', u'leg', u'mad', u'call', u'mad', u'leg', '', u'twenty', u'twenty', '', u'sister', u'call', u'leg', u'has', u'mad', u'door', '', u'together', u'talk', u'chicken', '', '', '', u'call', '', '', u'chicken', '', u'call', u'corn', '', u'sister', u'town', '', u'leg', u'mad', '', '', u'leg', u'call', u'together', u'dilemma', u'talk', u'bag', u'riding', u'spell', '', '']"
6,grade4,,"['wrote', 'though', 'though', 'heard', 'though', 'though', 'though', 'though', 'looking', 'though', 'wear', 'teach', 'though', 'heart', 'mean', 'whole', 'making', 'nothing', 'long', 'those']",,,,,"[u'rode', u'show', u'those', u'hurt', u'show', u'show', u'those', u'those', u'during', u'show', u'pair', u'teeth', u'those', u'hard', u'seen', u'hold', u'working', u'something', u'wrong', u'though']","[u'write', u'thought', u'thought', u'hear', u'through', u'thought', u'thought', u'through', u'working', u'through', u'hear', u'teacher', u'through', u'heat', u'meant', u'whose', u'talking', u'anything', u'along', u'whose']","['', '', '', u'head', '', '', '', '', u'loving', '', u'bear', u'reach', '', '', '', '', u'taking', '', u'song', '']","[u'tomorrow', u'such', u'such', '', u'such', u'which', u'which', u'such', '', u'which', '', '', u'which', u'begin', u'quite', u'bear', '', u'laugh', '', u'their']"
